{
  "$schema": "https://json-schema.org/draft/2020-12/schema",
  "$id": "https://raw.githubusercontent.com/EffortlessMetrics/perl-lsp/master/.claude/swarm-state/findings.schema.json",
  "title": "Swarm Findings Ledger",
  "type": "object",
  "additionalProperties": false,
  "required": [
    "schema_version",
    "last_updated",
    "findings"
  ],
  "properties": {
    "_comment": {
      "type": "string"
    },
    "schema_version": {
      "const": 1
    },
    "last_updated": {
      "type": "string",
      "format": "date"
    },
    "findings": {
      "type": "array",
      "items": {
        "$ref": "#/$defs/finding"
      }
    }
  },
  "$defs": {
    "finding": {
      "type": "object",
      "additionalProperties": false,
      "required": [
        "id",
        "kind",
        "status",
        "recorded_on",
        "summary",
        "decision",
        "surfaces",
        "evidence",
        "follow_up"
      ],
      "properties": {
        "id": {
          "type": "string",
          "pattern": "^SWARM-FINDING-[0-9]{4}$"
        },
        "kind": {
          "type": "string",
          "enum": [
            "control_plane",
            "runtime_invariant",
            "docs_drift",
            "workflow_gap",
            "tracking_gap"
          ]
        },
        "status": {
          "type": "string",
          "enum": [
            "active",
            "landed",
            "watching",
            "superseded"
          ]
        },
        "recorded_on": {
          "type": "string",
          "format": "date"
        },
        "summary": {
          "type": "string",
          "minLength": 1
        },
        "decision": {
          "type": "string",
          "minLength": 1
        },
        "surfaces": {
          "type": "array",
          "minItems": 1,
          "items": {
            "type": "string",
            "minLength": 1
          }
        },
        "evidence": {
          "type": "array",
          "minItems": 1,
          "items": {
            "$ref": "#/$defs/evidence"
          }
        },
        "follow_up": {
          "type": "array",
          "items": {
            "type": "string",
            "minLength": 1
          }
        },
        "notes": {
          "type": "string"
        }
      }
    },
    "evidence": {
      "type": "object",
      "additionalProperties": false,
      "required": [
        "type",
        "ref"
      ],
      "properties": {
        "type": {
          "type": "string",
          "enum": [
            "file",
            "pr",
            "issue",
            "doc",
            "hook",
            "setting"
          ]
        },
        "ref": {
          "type": "string",
          "minLength": 1
        }
      }
    }
  }
}
